{"canonical_encoding_version":1,"contract_binding":{"contract_id":"gateway-vnext.shared-canonical-encoding","semantic_version":"1.0.0"},"files":[{"case_count":18,"case_schema_id":"gateway-vnext.canonical-encoding.digest-case.v1","media_type":"application/x-ndjson","path":"digest.jsonl","raw_sha256":"sha256:27abf0c77a8900cb3a615eef66d6bdad18120e773849987e039d00c8d4bea075","size_bytes":5907},{"case_count":42,"case_schema_id":"gateway-vnext.canonical-encoding.invalid-case.v1","media_type":"application/x-ndjson","path":"invalid.jsonl","raw_sha256":"sha256:6da2c3e52e4ced9767b0661726efce0ce6328b2e70a2de8635314d2a0a7d825a","size_bytes":10689},{"case_count":9,"case_schema_id":"gateway-vnext.canonical-encoding.jcs-case.v1","media_type":"application/x-ndjson","path":"jcs.jsonl","raw_sha256":"sha256:4b8ce084d12d09afc829af4cf9f3bfe30e345f993b3a39235033a9278f28baa2","size_bytes":1872},{"case_count":57,"case_schema_id":"gateway-vnext.canonical-encoding.scalar-case.v1","media_type":"application/x-ndjson","path":"scalar.jsonl","raw_sha256":"sha256:0f451a3af65ea41e0b72e6218851f9469ac6fc757ed47de57abd254855e29f72","size_bytes":21068}],"owner":"shared-kernel","vector_set_content_digest":"sha256:41b1106bc04c852cb1e94d512178e979ff006eb657b3729dce55afe633ffe648","vector_set_id":"gateway-vnext.shared-kernel.canonical-encoding.v1","vector_set_schema_version":1}
